{
  "version": 1,
  "round_id": "R-example-01",
  "assignment": "A1",
  "attempt": 1,
  "status": "result-ready",
  "base_sha": "1111111111111111111111111111111111111111",
  "spec_sha256": "c2df34881cbeb73a8a753d456cffe73f9c6d88e33a0e56841eaf99c03bef6578",
  "packet_sha256": "45ba2499bd7b076526c42bffbbf74854b2d6a6ef87a91cb0168322629e7fa21d",
  "branch": "docs/session-responses",
  "head_sha": "2222222222222222222222222222222222222222",
  "pr": "https://example.invalid/session-service/pull/1",
  "verification": [
    {
      "id": "local",
      "status": "passed",
      "command": [
        "git",
        "diff",
        "--check"
      ],
      "head_sha": "2222222222222222222222222222222222222222",
      "environment": "offline",
      "evidence": "evidence/A1-1.md",
      "exit_code": 0,
      "summary": "Illustrative whitespace gate only; not an executed result."
    }
  ]
}
